source_id,split,text,emoji,label,intent_label,dissonance_label
train:1019:4,train,and then we have to stop at souplantation. it's creamy tomato soup day.,📋,Plan,Plan,Low
train:1019:6,train,i have a better idea.,💡,Advise,Advise,Low
train:1019:7,train,you wanna go to pottery barn first?,🤨,Doubt,Doubt,Medium
train:1021:0,train,good morning.,✨,Greet,Greet,Low
train:1021:1,train,"sheldon, sit down.",🗓️,Arrange,Arrange,Low
train:1021:2,train,sheldon you know that we care about you.,🧡,Care,Care,Low
train:1021:3,train,and it's because we care about you that we've decided we have to speak up.,💡,Explain,Explain,Low
train:1021:4,train,"you're hurting the people around you, sweetie.",🤨,Criticize,Criticize,High
train:1021:7,train,"sheldon, you need to learn how to drive.",🧠,Advise,Advise,Low
train:1021:9,train,penny's taking you to the dmv. i'm going to bed.,📋,Plan,Plan,Low
train:1021:10,train,good night.,🏃,Leave,Leave,Low
train:1021:12,train,okay.,👍,Agree,Agree,Low
train:1021:14,train,fine.,🏃,Leave,Leave,Low
train:1021:15,train,i wanna go to the comic-book store.,🗺️,Plan,Plan,Low
train:1022:3,train,"you know, i gotta ask, why didn't you just get a license at 16 like everybody else?",🤔,Doubt,Doubt,Medium
train:1022:5,train,doing what?,🤔,Doubt,Doubt,Medium
train:1022:8,train,take this to the testing area. name at the top.,🗓️,Arrange,Arrange,Low
train:1022:9,train,"sign the bottom, answer the questions, bring it back. next.",⏰,Arrange,Arrange,Low
train:1022:10,train,application?,👌,Confirm,Confirm,Low
train:1022:12,train,the application in your hand. give it to her.,📅,Arrange,Arrange,Low
train:1022:13,train,oh.,🤝,Acknowledge,Acknowledge,Low
train:1022:14,train,take this to the testing area. name at the top.,🗓️,Arrange,Arrange,Low
train:1022:15,train,"sign the bottom, answer the questions, bring it back. next.",⏰,Arrange,Arrange,Low
train:1022:16,train,"excuse me, but i have some concerns about these questions.",🙋,Ask for help,Ask for help,Low
train:1024:0,train,"again, i'm sorry that the demonstration didn't quite work out.",😔,Apologise,Apologise,Low
train:1024:2,train,now to tell you about the theoretical physics department is dr. sheldon cooper.,👋,Introduce,Introduce,Low
train:1024:4,train,"if you don't do this, i won't take you to the comic-book store.",⚠️,Warn,Warn,Medium
train:1024:5,train,hello.,👋,Greet,Greet,Low
train:1024:6,train,"nice work with the laser, by the way.",🏆,Praise,Praise,Low
train:1024:8,train,"of course, i was 14 and had achieved more than you could ever hope to despite my 9:00 bedtime.",💸,Flaunt,Flaunt,Medium
train:1024:11,train,any questions?,💭,Asking for opinions,Asking for opinions,Low
train:1024:12,train,of course not.,🙅,Oppose,Oppose,High
train:1024:13,train,"now, if you'll excuse me, the latest issue of batman is out.",🚪,Leave,Leave,Low
train:1025:3,train,isn’t there a policy against dating graduate students?,🤔,Doubt,Doubt,Medium
train:1025:4,train,damn. there's always a catch.,😮‍💨,Complain,Complain,High
train:1025:6,train,"excuse me, dr. cooper?",👋,Greet,Greet,Low
train:1025:7,train,i'm ramona nowitzki. i was at your talk last night.,📛,Introduce,Introduce,Low
train:1025:8,train,"howard wolowitz, department of engineering co-designer of the international space station's liquid-waste-disposal system.",📛,Introduce,Introduce,Low
train:1025:14,train,it's what i do.,😎,Flaunt,Flaunt,Medium
train:1025:15,train,"you know, the pishkin-wolowitz liquid-waste-disposal system is turning a few heads as well.",🤝,Introduce,Introduce,Low
train:1025:17,train,"you know, i'd love to hear more about how you intend to add neutrinos.",💭,Asking for opinions,Asking for opinions,Low
train:1025:18,train,it doesn't have to be coffee. how about dinner?,🎉,Invite,Invite,Low
train:1025:19,train,i never eat in strange restaurants. one runs the risk of non-standard cutlery.,🤷,Refuse,Refuse,Low
train:1025:22,train,you got it. i already have your address.,👋,Leave,Leave,Low
train:1025:23,train,what a nice girl.,👏,Praise,Praise,Low
train:1026:1,train,sheldon cooper?,✅,Confirm,Confirm,Low
train:1026:2,train,thanks. where should i put this?,🙏,Thank,Thank,Low
train:1026:3,train,the viewing area's right over there.,ℹ️,Inform,Inform,Low
train:1026:4,train,"sheldon, your girl-date-person-ramona's here.",ℹ️,Inform,Inform,Low
train:1026:5,train,my hypotheses tend to have that effect.,💸,Flaunt,Flaunt,Medium
train:1026:6,train,i'm sorry i didn't bring enough for your friends.,🥺,Apologise,Apologise,Low
train:1026:8,train,"to watch, right?",✅,Confirm,Confirm,Low
train:1026:9,train,"come on, let's go.",👋,Leave,Leave,Low
train:1026:10,train,you just have a nice whatever this is.,🏃,Leave,Leave,Low
train:1027:1,train,is it girls? guys? sock puppets?,🤔,Doubt,Doubt,Medium
train:1027:3,train,i'm sorry?,🤔,Doubt,Doubt,Medium
train:1027:4,train,he'll spin a cocoon and emerge two months later with moth wings and an exoskeleton.,😜,Joke,Joke,Low
train:1027:5,train,"okay, well, thanks for the nightmares.",😏,Taunt,Taunt,High
train:1027:7,train,"yeah, i'm busy. so good night.",🏃,Leave,Leave,Low
train:1027:8,train,her loss. let's go.,👋,Leave,Leave,Low
train:1028:0,train,not in these pants.,👎,Oppose,Oppose,High
train:1028:1,train,"she's smart, insightful.",👏,Praise,Praise,Low
train:1028:2,train,"she has a very unique way of, you know, revering me.",👏,Praise,Praise,Low
train:1028:6,train,touché.,🏆,Praise,Praise,Low
train:1028:11,train,wait for me.,🚪,Leave,Leave,Low
train:1028:12,train,so have you worked out the neutrino issue?,🧡,Care,Care,Low
train:1028:14,train,aren't i?,👌,Confirm,Confirm,Low
train:1030:0,train,penny. penny. penny.,😊,Greet,Greet,Low
train:1030:2,train,"look, ramona finally dozed off, and i need you to help me get rid of her.",🙋,Ask for help,Ask for help,Low
train:1030:5,train,um.... she distracted me.,💡,Explain,Explain,Low
train:1030:6,train,i have important things to do.,🏃,Leave,Leave,Low
train:1030:7,train,"really? well, then will you explain it to me?",✅,Confirm,Confirm,Low
train:1030:9,train,"uh, yeah, no, that's not it.",👎,Oppose,Oppose,High
train:1030:12,train,"oh, gee. okay.",✅,Agree,Agree,Low
train:1030:15,train,"sure, sisters. heh, heh.",✅,Agree,Agree,Low
train:1031:0,train,"excuse me, dr. cooper. i'm kathy o'brian.",😊,Greet,Greet,Low
train:1031:3,train,would you possibly have any time for me to pick your brain?,✅,Confirm,Confirm,Low
train:1031:5,train,i have the address.,👋,Leave,Leave,Low
train:1031:6,train,what a nice girl.,🌟,Praise,Praise,Low
train:1031:7,train,"sheldon, do you see what just happened here?",👌,Confirm,Confirm,Low
train:1031:8,train,i'm on a roll.,💎,Flaunt,Flaunt,Medium
train:1032:0,train,"you might wanna slow down a bit, buddy.",☝️,Advise,Advise,Low
train:1034:0,train,did i miss anything? did they kick giselle off?,😕,Doubt,Doubt,Medium
train:1034:6,train,"freeze frame, freeze frame.",⏰,Arrange,Arrange,Low
train:1034:8,train,"well, then, what took you so long?",🤔,Doubt,Doubt,Medium
train:1034:10,train,"oh, do we have to suffer through this transparently manipulative, pseudo-reality again?",😕,Doubt,Doubt,Medium
train:1034:20,train,why would you do that?,🤨,Doubt,Doubt,Medium
train:1034:22,train,all right. i didn't know. i'm sorry.,🥺,Apologise,Apologise,Low
train:1034:23,train,three strikes and you're out.,⚠️,Warn,Warn,Medium
train:1034:24,train,it's a sports metaphor.,💬,Explain,Explain,Low
train:1034:25,train,"all right, yeah, i'll play along.",✅,Agree,Agree,Low
train:1034:26,train,you violated my rule about forwarding e-mail humor.,🤨,Criticize,Criticize,High
train:1034:27,train,they're cute and they can't spell because they're cats.,💡,Explain,Explain,Low
train:1034:28,train,"touching my food, strike two.",🤨,Criticize,Criticize,High
train:1034:29,train,"don't worry, they only stay on your record for a year.",💛,Comfort,Comfort,Low
train:1036:2,train,"when we find it, wanna go with us?",❓,Asking for opinions,Asking for opinions,Low
train:1036:3,train,you're not even gonna get near that place.,⛔,Oppose,Oppose,High
train:1036:5,train,no one said anything of the kind to neil armstrong.,⛔,Oppose,Oppose,High
train:1036:10,train,coming right up.,🚪,Leave,Leave,Low
train:1036:11,train,"oh, i didn't tell you?",🤨,Doubt,Doubt,Medium
train:1036:12,train,you can't do that. not only is it a violation of california state law it flies directly in the face of cheesecake factory policy.,⛔,Oppose,Oppose,High
train:1036:15,train,what? i'm not gonna apologize to that nutcase.,🚫,Refuse,Refuse,Low
train:1036:18,train,i like hanging out but i'm not gonna apologize for something i didn't do.,🚫,Refuse,Refuse,Low
train:1036:24,train,thank you.,💛,Thank,Thank,Low
train:1036:25,train,i dare you.,🏃,Leave,Leave,Low
train:1038:3,train,do those look familiar?,👌,Confirm,Confirm,Low
train:1038:4,train,how the hell did you get them up on that telephone wire?,🤔,Doubt,Doubt,Medium
train:1038:7,train,"look, wait, sheldon.",🛑,Prevent,Prevent,Medium
train:1038:10,train,i've done no stupid things.,👎,Oppose,Oppose,High
train:1038:11,train,i'm willing to concede that you've done some stupid things.,🤡,Taunt,Taunt,High
train:1038:13,train,what happened?,🤔,Doubt,Doubt,Medium
train:1038:14,train,"leonard, remember when i said it was on?",👌,Confirm,Confirm,Low
train:1039:1,train,"okay, for the record, what you are doing is really creepy.",🛑,Warn,Warn,Medium
train:1039:4,train,"hi, mom. how are you?",😊,Greet,Greet,Low
train:1039:6,train,she keeps sitting in my spot.,😮‍💨,Complain,Complain,High
train:1039:7,train,and she touched my food.,😤,Complain,Complain,High
train:1039:8,train,"no, that's not fair.",🙄,Complain,Complain,High
train:1040:0,train,penny.,👋,Greet,Greet,Low
train:1040:1,train,penny.,✨,Greet,Greet,Low
train:1040:2,train,penny.,👋,Greet,Greet,Low
train:1040:3,train,"i am very, very sorry for what i have done.",🙏,Apologise,Apologise,Low
train:1040:6,train,can i sit wherever i want?,🤝,Confirm,Confirm,Low
train:1040:7,train,never mind. never mind. that's not important.,🫐,Comfort,Comfort,Low
train:1040:8,train,"sheldon, this was big of you.",👏,Praise,Praise,Low
train:1040:9,train,yes?,🤝,Confirm,Confirm,Low
train:1041:2,train,oh. okay. come on in.,🍽️,Invite,Invite,Low
train:1041:4,train,what do we do now?,❓,Asking for opinions,Asking for opinions,Low
train:1043:0,train,you brought a girl to the mars-rover control room?,🤔,Doubt,Doubt,Medium
train:1043:2,train,"wait a minute, so the eye patch and the insults worked?",😕,Doubt,Doubt,Medium
train:1043:3,train,"no, there were three other guys with eye patches. it was a fiasco.",⛔,Oppose,Oppose,High
train:1043:4,train,"you help me get the rover out, and you get stephanie out before somebody notices.",📅,Arrange,Arrange,Low
train:1043:5,train,really? they don't let strange women from honky-tonks play with $200 million government projects on distant planets?,🤨,Doubt,Doubt,Medium
train:1043:6,train,"yes, i was bad. maybe she'll spank me. can we please move on?",😮‍💨,Complain,Complain,High
train:1043:7,train,"hey, howard, it's getting late, so do i get to drive this thing or what?",🤔,Asking for opinions,Asking for opinions,Low
train:1043:8,train,"yeah, no, i'm sorry, but something's come up.",🥺,Apologise,Apologise,Low
train:1043:11,train,so my friend leonard is gonna take you home.,ℹ️,Inform,Inform,Low
train:1043:12,train,how nice. maybe they can carpool when they visit you in federal prison.,🤡,Taunt,Taunt,High
train:1045:0,train,thank god for plan b.,👍,Thank,Thank,Low
train:1045:1,train,"no, you're mistaken.",🙅,Oppose,Oppose,High
train:1045:6,train,leonard is signaling that he'd like to talk to me in private.,📝,Inform,Inform,Low
train:1045:8,train,"well, that does sound like me, but no.",⛔,Oppose,Oppose,High
train:1046:0,train,"yeah, um, listen, i have to kind of sneak out for a while.",🗺️,Plan,Plan,Low
train:1046:2,train,"well, who would ask me?",😕,Doubt,Doubt,Medium
train:1046:4,train,you brought me here to inform me you can't tell me where you're going.,✅,Confirm,Confirm,Low
train:1046:5,train,and you can't tell me who might ask?,👌,Confirm,Confirm,Low
train:1046:9,train,"what is--? no, not like that.",⛔,Oppose,Oppose,High
train:1046:10,train,i'm going to the office.,📋,Plan,Plan,Low
train:1047:2,train,"no, just the one.",🙅,Oppose,Oppose,High
train:1047:4,train,so how was your day?,🫒,Care,Care,Low
train:1047:8,train,maybe we should think about going to the bedroom.,🧠,Advise,Advise,Low
train:1047:9,train,"that's a good idea, because there's a bed there, and i'm very, very, very pro-bed.",🤝,Agree,Agree,Low
train:1047:10,train,you want me to stop and call him back right now?,👌,Confirm,Confirm,Low
train:1048:2,train,"so, what we did was in fact dating?",👌,Confirm,Confirm,Low
train:1048:3,train,exactly. thank you.,👍,Thank,Thank,Low
train:1048:4,train,"do me a favor, tell koothrappali that next time you see him.",🚨,Ask for help,Ask for help,Low
train:1048:6,train,"a  doctor  doctor, or a you kind of doctor?",👌,Confirm,Confirm,Low
train:1048:7,train,"smart, pretty.",🏆,Praise,Praise,Low
train:1048:9,train,"if your friend thinks he's dating someone but he's not, because in fact, you're dating her does that make you a bad person?",💭,Asking for opinions,Asking for opinions,Low
train:1048:10,train,is that friend wolowitz?,👌,Confirm,Confirm,Low
train:1049:4,train,hello?,👋,Greet,Greet,Low
train:1049:5,train,"oh, stephanie, thanks for calling me back. i was worried.",👍,Thank,Thank,Low
train:1049:7,train,uh-huh.,✅,Acknowledge,Acknowledge,Low
train:1049:8,train,uh-huh.,👌,Acknowledge,Acknowledge,Low
train:1049:9,train,uh-huh.,✅,Acknowledge,Acknowledge,Low
train:1049:11,train,thanks for calling.,👍,Thank,Thank,Low
train:1050:1,train,"hi, howard.",😊,Greet,Greet,Low
train:1050:3,train,that's ridiculous. why are you cooperating with him?,😕,Doubt,Doubt,Medium
train:1050:5,train,"howard, come on. i didn't plan on this.",💡,Explain,Explain,Low
train:1050:8,train,"hello, howard.",✨,Greet,Greet,Low
train:1050:10,train,"yeah, my roommate. she just went through a bad breakup.",🤝,Introduce,Introduce,Low
train:1051:1,train,it's colloquial. a conversation opener.,📖,Explain,Explain,Low
train:1051:2,train,so do you find the weather satisfying?,🤔,Asking for opinions,Asking for opinions,Low
train:1051:4,train,please don't do that.,⚠️,Prevent,Prevent,Medium
train:1051:5,train,but i'm given to understand that when you have something awkward to discuss it's more palatable to preface it with banal chitchat.,📖,Explain,Explain,Low
train:1051:6,train,no.,⛔,Oppose,Oppose,High
train:1051:7,train,her name is dr. stephanie barnett.,👋,Introduce,Introduce,Low
train:1051:8,train,and she's a highly distinguished surgical resident at fremont memorial.,📛,Introduce,Introduce,Low
train:1051:9,train,"see, of the handful of women leonard's been involved with she's the only one i have ever found tolerable.",👋,Introduce,Introduce,Low
train:1052:0,train,"well, this is very pleasant.",🌟,Praise,Praise,Low
train:1052:4,train,that's very interesting.,🏆,Praise,Praise,Low
train:1052:9,train,"i spent so much of my childhood at that hospital. it-when i was 12, i got to ride there in a helicopter.",📛,Introduce,Introduce,Low
train:1052:10,train,a little mishap while i was building my own cat scanner.,📛,Introduce,Introduce,Low
train:1052:11,train,"i'm sorry, you tried to build your own cat scanner?",🤔,Doubt,Doubt,Medium
train:1052:15,train,excuse me.,🏃,Leave,Leave,Low
train:1052:18,train,i do. do you?,🤨,Doubt,Doubt,Medium
train:1052:19,train,"okay, here's my question: why did you sit down?",🤔,Doubt,Doubt,Medium
train:1052:20,train,"to help. look, if you fail at this relationship and history suggests you will then we risk losing the medical officer that our landing party has always needed.",📖,Explain,Explain,Low
train:1052:21,train,what landing party?,🤔,Doubt,Doubt,Medium
train:1053:2,train,"ha, ha. what do you think i did?",❓,Asking for opinions,Asking for opinions,Low
train:1053:4,train,"i'm sorry i'm late, but your companion left the most indecipherable invitation.",🥺,Apologise,Apologise,Low
train:1053:5,train,what invitation?,😕,Doubt,Doubt,Medium
train:1053:6,train,"if you were trying to make it impossible to locate you, you couldn't have done better.",🤡,Taunt,Taunt,High
train:1053:8,train,it took 20 minutes to go through the browser history on your computer to see what movie times you looked up.,💬,Explain,Explain,Low
train:1053:12,train,he's finding the acoustic sweet spot.,💡,Explain,Explain,Low
train:1053:15,train,"...it's fine, you know. he's sweet.",💛,Comfort,Comfort,Low
train:1053:16,train,my apologies. you've been sitting in it all along.,😔,Apologise,Apologise,Low
train:1054:2,train,this is stephanie's facebook page.,🤝,Introduce,Introduce,Low
train:1054:4,train,who's mike? why does he get a digital sheep and not you?,🤨,Doubt,Doubt,Medium
train:1054:6,train,"okay, i'm gonna make this very simple for you.",💡,Explain,Explain,Low
train:1054:7,train,you are not in this relationship.,📝,Inform,Inform,Low
train:1054:8,train,"ergo, you have no say in anything that happens between me and stephanie.",💬,Explain,Explain,Low
train:1054:9,train,i'm afraid i can't allow that.,🚫,Refuse,Refuse,Low
train:1054:10,train,"general order 104, section a does not apply in this situation.",👎,Oppose,Oppose,High
train:1055:4,train,this is banana bread.,📛,Introduce,Introduce,Low
train:1055:5,train,this is a door knob.,🤝,Introduce,Introduce,Low
train:1055:6,train,it's my understanding that an unsolicited gift of food can be a precursor to an impromptu invitation to come in and chat.,📖,Explain,Explain,Low
train:1055:7,train,"sheldon, would you like to come in?",🎉,Invite,Invite,Low
train:1055:8,train,i suppose i could spare a few minutes.,✅,Agree,Agree,Low
train:1056:0,train,no.,👎,Oppose,Oppose,High
train:1056:1,train,how can you be sure?,🤔,Doubt,Doubt,Medium
train:1056:4,train,"so, what is the down and the low?",😕,Doubt,Doubt,Medium
train:1056:5,train,"and don't worry, this is all entirely confidential so you feel free to include any and all shortcomings in the bedroom.",🥹,Comfort,Comfort,Low
train:1056:6,train,heh. we never got to the bedroom.,👎,Oppose,Oppose,High
train:1056:8,train,okay. all right. you know what? i'll tell you what happened.,📅,Plan,Plan,Low
train:1056:11,train,"it's not enough that you made me watch that movie, but now you mock me with it?",😕,Doubt,Doubt,Medium
train:1057:0,train,penny.,😊,Greet,Greet,Low
train:1057:1,train,penny.,😊,Greet,Greet,Low
train:1057:3,train,penny.,👋,Greet,Greet,Low
train:1057:5,train,"oh, thank you.",🙏,Thank,Thank,Low
train:1057:7,train,i apologize.,🥺,Apologise,Apologise,Low
train:1057:8,train,"oh, thank you.",🙏,Thank,Thank,Low
train:1057:9,train,so have you and i returned to a social equilibrium?,🤝,Confirm,Confirm,Low
train:1058:5,train,"hey, how's my big crybaby?",🧡,Care,Care,Low
train:1058:6,train,"okay, i'm just teasing you.",😂,Joke,Joke,Low
train:1058:8,train,"it's all good. what do you say we get you home, put you to bed?",🧠,Advise,Advise,Low
train:1058:9,train,oh. are you still gonna spend the night?,👌,Confirm,Confirm,Low
train:1058:11,train,"thank you, dr. cooper.",🙏,Thank,Thank,Low
train:1058:13,train,"okay, i'm gonna go get your discharge papers.",🗺️,Plan,Plan,Low
train:1058:14,train,what?,🤔,Doubt,Doubt,Medium
train:1058:15,train,you seem like a perfectly pleasant person.,🏆,Praise,Praise,Low
train:1059:0,train,can you open this for me?,🥺,Ask for help,Ask for help,Low
train:1059:3,train,"what? no. no, that's not right.",⛔,Oppose,Oppose,High
train:1059:4,train,"oh, man, did you switch your status before she did?",🤝,Confirm,Confirm,Low
train:1059:6,train,seriously? you went first after only two weeks?,😕,Doubt,Doubt,Medium
train:1059:8,train,"it's not bold, it's a mistake.",⛔,Oppose,Oppose,High
train:1059:12,train,you hacked my facebook account?,🤨,Doubt,Doubt,Medium
train:1059:14,train,are you insane? now she's gonna think i'm desperate.,🙄,Complain,Complain,High
train:1059:15,train,you've destroyed this relationship.,🤨,Criticize,Criticize,High
train:1059:20,train,really?,✅,Confirm,Confirm,Low
train:1060:1,train,"and he brought flowers. oh, thanks, ross. i'm really more of a candy kind of guy.",💛,Thank,Thank,Low
train:1060:6,train,"okay, wow.",👌,Acknowledge,Acknowledge,Low
train:1060:7,train,"uh, dad, emma's in the nursery. i'll take you now if you want.",🚪,Leave,Leave,Low
train:1060:8,train,"and, ross, i need to talk to you.",📢,Inform,Inform,Low
train:1062:0,train,"dude, i just did something terrible.",📝,Inform,Inform,Low
train:1062:2,train,"no, no. that was jack. rachel thinks i asked her to marry me.",⛔,Oppose,Oppose,High
train:1062:3,train,"again, what?",🤔,Doubt,Doubt,Medium
train:1062:4,train,"it wasn't my ring. it fell out of ross' jacket and when i knelt down to pick it up, rachel thought i was proposing.",💬,Explain,Explain,Low
train:1062:5,train,ross had a ring? and he was gonna propose?,🤨,Doubt,Doubt,Medium
train:1062:10,train,"if you clear things up with rachel, ross never needs to find out.",☝️,Advise,Advise,Low
train:1062:11,train,"all right, let's not get carried away.",✅,Agree,Agree,Low
train:1064:0,train,what? did you know he was gonna ask me?,🤨,Doubt,Doubt,Medium
train:1064:3,train,really? even ross?,😕,Doubt,Doubt,Medium
train:1064:4,train,especially ross.,🔥,Emphasize,Emphasize,Low
train:1064:6,train,i guess i'll just... i'll come back.,👋,Leave,Leave,Low
train:1064:8,train,i guess so.,🤝,Agree,Agree,Low
train:1065:0,train,it can't be me. i'm standing right here.,🙅,Oppose,Oppose,High
train:1065:1,train,come on.,🎉,Invite,Invite,Low
train:1065:2,train,come on.,👋,Leave,Leave,Low
train:1065:3,train,we're not peeking?,🤨,Doubt,Doubt,Medium
train:1066:0,train,"oh, joey, this ring, i... it's beautiful. i love it.",🏆,Praise,Praise,Low
train:1066:1,train,"yeah. uh, look, rach, there's something i gotta tell you.",📝,Inform,Inform,Low
train:1066:2,train,why do you think she won't take my breast?,❓,Asking for opinions,Asking for opinions,Low
train:1066:3,train,"it's all right, honey. it takes babies a while to get it.",🥹,Comfort,Comfort,Low
train:1066:8,train,do you think my nipples are too big for her mouth?,💭,Asking for opinions,Asking for opinions,Low
train:1066:9,train,she looks scared. doesn't she look scared?,🤔,Asking for opinions,Asking for opinions,Low
train:1066:11,train,why don't we try massaging the breast to stimulate the flow?,🧠,Advise,Advise,Low
train:1068:1,train,this is okay. we're all adults here. there's nothing to be ashamed of.,💛,Comfort,Comfort,Low
train:1068:2,train,"now, let's put our underwear in our pockets and walk out the door.",📅,Arrange,Arrange,Low
train:1069:0,train,"hi, dad.",✨,Greet,Greet,Low
train:1069:1,train,"i just want you to know that what you witnessed in there, that wasn't for fun.",💬,Explain,Explain,Low
train:1069:2,train,"look, i just don't want you to think that we're animals who do it whenever we want.",💬,Explain,Explain,Low
train:1069:3,train,"well, i don't think that.",👎,Oppose,Oppose,High
train:1069:6,train,"the truth is, dad, we're trying.",❗,Emphasize,Emphasize,Low
train:1069:7,train,"oh, my god, this is so exciting.",👏,Praise,Praise,Low
train:1069:8,train,"well, get back in there. i'll guard the door.",😏,Taunt,Taunt,High
train:1069:11,train,you're right. this is about your positions.,🤝,Agree,Agree,Low
train:1070:0,train,"well, now's a good time. i'm on my way to have my ears cut off.",😜,Joke,Joke,Low
train:1070:1,train,joey asked me to marry him.,📢,Inform,Inform,Low
train:1070:2,train,"what, are you crazy? you just had ross' baby.",😑,Criticize,Criticize,High
train:1070:3,train,"it's so inappropriate. no, it is worse than that. it is wrong.",🤔,Criticize,Criticize,High
train:1070:5,train,"well, do you love him?",✅,Confirm,Confirm,Low
train:1070:6,train,"honey, the question is do you really want to marry joey?",👌,Confirm,Confirm,Low
train:1070:7,train,no.,⛔,Oppose,Oppose,High
train:1070:8,train,"no, i don't.",⛔,Oppose,Oppose,High
train:1070:9,train,could you be a dear and go tell him?,🚨,Ask for help,Ask for help,Low
train:1071:0,train,you still haven't told rachel you weren't proposing?,✅,Confirm,Confirm,Low
train:1071:2,train,"joey, you have to tell her what's going on. and what did it look like?",💥,Emphasize,Emphasize,Low
train:1071:3,train,the stupid baby's head was blocking most of it.,🙄,Complain,Complain,High
train:1071:4,train,"go and tell rachel right now, before ross finds out.",⏰,Arrange,Arrange,Low
train:1071:5,train,"okay, look, just do it gently.",💛,Comfort,Comfort,Low
train:1071:6,train,you're right.,👍,Agree,Agree,Low
train:1071:7,train,"you're right. i'll go tell her now before ross finds out, and i'll be gentle.",✅,Agree,Agree,Low
train:1071:8,train,i am a gentle person.,👋,Introduce,Introduce,Low
train:1072:4,train,i don't think you do.,⛔,Oppose,Oppose,High
train:1072:5,train,you didn't propose to me.,💥,Emphasize,Emphasize,Low
train:1072:13,train,but joey did.,❗,Emphasize,Emphasize,Low
train:1072:14,train,joey proposed to you?,👌,Confirm,Confirm,Low
train:1072:15,train,he was right there. he got down on one knee and he proposed.,💥,Emphasize,Emphasize,Low
train:1072:16,train,but i didn't... i didn't propose.,👎,Oppose,Oppose,High
