source_id,split,text,emoji,label,intent_label,dissonance_label
train:707:6,train,she's dating no one.,🔥,Emphasize,Emphasize,Low
train:707:7,train,that's how the world works.,💬,Explain,Explain,Low
train:707:8,train,someone sounds   jealous.,😏,Taunt,Taunt,High
train:708:1,train,"ooh, nice assist!",👏,Praise,Praise,Low
train:708:2,train,"hey, i played basketball when i was a kid until my parents let me stop.",🤝,Introduce,Introduce,Low
train:710:0,train,"yeah, you didn't have to kidnap me, dina.",👎,Oppose,Oppose,High
train:710:1,train,"all right, everybody. first on the agenda: free talk.",ℹ️,Inform,Inform,Low
train:710:2,train,"also, no religion or politics. too divisive.",ℹ️,Inform,Inform,Low
train:710:3,train,"also, don't tell a story about someone we don't all know.",ℹ️,Inform,Inform,Low
train:710:4,train,it makes people feel excluded.,📝,Inform,Inform,Low
train:710:5,train,"other than that, sky's the limit.",📝,Inform,Inform,Low
train:710:6,train,we're not talking about music!,👎,Oppose,Oppose,High
train:711:1,train,are you literally insane?,🤨,Criticize,Criticize,High
train:711:2,train,"sorry, mateo. could you throw us back the muffin ball, though?",🥺,Apologise,Apologise,Low
train:711:3,train,i could. but i won't.,🤷,Refuse,Refuse,Low
train:711:4,train,"hey, yo, you know what?",👋,Greet,Greet,Low
train:711:5,train,"hey, thanks, mateo!",🙏,Thank,Thank,Low
train:711:7,train,just get the blockers.,📅,Arrange,Arrange,Low
train:712:0,train,"can i start you ladies off with some drinks, or--",💭,Asking for opinions,Asking for opinions,Low
train:712:1,train,"cut to: glug, glug, glug, glug.",😂,Joke,Joke,Low
train:712:2,train,"oh, uh, white wine. two ice cubes.",📝,Inform,Inform,Low
train:712:3,train,i'll take a rusty spaniard.,📝,Inform,Inform,Low
train:712:4,train,that's fine. what do you want?,❓,Asking for opinions,Asking for opinions,Low
train:712:5,train,"i'll have four beers, please.",📝,Inform,Inform,Low
train:712:6,train,how about we order our meals at the same time and then maybe you can just bring the check now.,💡,Advise,Advise,Low
train:713:0,train,"seriously, dude?",😕,Doubt,Doubt,Medium
train:713:1,train,i'm throwing this away.,📢,Inform,Inform,Low
train:713:2,train,is that good?,🤔,Doubt,Doubt,Medium
train:713:3,train,is the best you can do good? whoo.,🤡,Taunt,Taunt,High
train:713:5,train,"well, i get the emails.",📢,Inform,Inform,Low
train:713:6,train,"i mean, i'd say you're a natural.",👏,Praise,Praise,Low
train:713:7,train,please! anyone can hit that stupid mannequin.,😏,Taunt,Taunt,High
train:713:8,train,i did it! i'm simone biles!,💸,Flaunt,Flaunt,Medium
train:714:0,train,"so, cheyenne, how are things with you and bo?",🛡️,Care,Care,Low
train:714:1,train,"little dangerous, little mysterious, little dyslexic.",📛,Introduce,Introduce,Low
train:714:2,train,"and, um, sandra, you're still with jeff?",🫒,Care,Care,Low
train:714:3,train,"um, yeah. it's fine.",👍,Agree,Agree,Low
train:714:4,train,"it's fine? this is ladies' lunch, sandra.",🤔,Doubt,Doubt,Medium
train:714:5,train,we need deets.,📢,Inform,Inform,Low
train:714:6,train,"oh, okay. um...",✅,Acknowledge,Acknowledge,Low
train:714:7,train,"oh, god, he's...gentle and strong.",🏆,Praise,Praise,Low
train:714:8,train,sometimes he's dark.,📛,Introduce,Introduce,Low
train:715:0,train,"oh, yeah? what are you gonna do about it?",😏,Taunt,Taunt,High
train:715:1,train,call your girlfriend amy?,🙄,Taunt,Taunt,High
train:715:2,train,what? no. that's--why would i--,🙅,Oppose,Oppose,High
train:717:0,train,"okay, this is gonna sound so naughty, but should we get another round of drinks?",☝️,Advise,Advise,Low
train:717:1,train,"look, i really appreciate this gesture, i do.",🙏,Thank,Thank,Low
train:717:2,train,"yeah, um...",✅,Agree,Agree,Low
train:717:3,train,"yeah, i'm sorry this wasn't perfect.",🙏,Apologise,Apologise,Low
train:717:4,train,no. we can stay.,⛔,Oppose,Oppose,High
train:717:5,train,"no, it's fine. forget it, i'll just--",🥹,Comfort,Comfort,Low
train:717:6,train,i'll pay the check. ron?,📅,Plan,Plan,Low
train:717:7,train,"no, no, no. we can stay, dina.",⛔,Oppose,Oppose,High
train:717:8,train,i want to stay.,ℹ️,Inform,Inform,Low
train:717:10,train,okay. i would bang marcus...,📋,Plan,Plan,Low
train:717:11,train,"no, cheyenne, she's not an option.",👎,Oppose,Oppose,High
train:717:12,train,she sucks!,😮‍💨,Complain,Complain,High
train:717:14,train,"no. no, no, no, really. i have.",👎,Oppose,Oppose,High
train:717:15,train,"don't know why we're laughing, because i did.",📖,Explain,Explain,Low
train:717:17,train,i had to erase the security camera footage.,📝,Inform,Inform,Low
train:718:0,train,where are the paper towels?,🙋,Ask for help,Ask for help,Low
train:718:1,train,"i'm sorry, i don't think we sell those here.",🥺,Apologise,Apologise,Low
train:718:3,train,he's gonna be fine.,💛,Comfort,Comfort,Low
train:719:1,train,"look, adam and i have been together a really long time.",💡,Explain,Explain,Low
train:719:2,train,"and i just wanna know that if we are together it's because we want to be, and not because we're afraid of change.",📖,Explain,Explain,Low
train:719:3,train,three jet skis in that garage.,👋,Introduce,Introduce,Low
train:719:4,train,thanks.,🙏,Thank,Thank,Low
train:719:6,train,"i'm like, maybe i'll change my hair.",🗺️,Plan,Plan,Low
train:720:0,train,oh. you okay?,🛡️,Care,Care,Low
train:720:1,train,i just wanna relax here on the beach for a while.,💬,Explain,Explain,Low
train:720:2,train,winner gets amy.,📢,Inform,Inform,Low
train:720:3,train,you--what--you can't win a person by throwing a taped up muffin at a bucket.,⛔,Oppose,Oppose,High
train:720:4,train,"oh, yeah? then what's this?",🙄,Taunt,Taunt,High
train:720:5,train,boom! yes!,💎,Flaunt,Flaunt,Medium
train:722:1,train,"what's up, ames?",🧡,Care,Care,Low
train:722:2,train,"hey, uh...keep me posted on things.",📝,Inform,Inform,Low
train:722:4,train,hmm. did that make sense to you?,❓,Asking for opinions,Asking for opinions,Low
train:722:5,train,no.,🙅,Oppose,Oppose,High
train:722:6,train,good.,✅,Acknowledge,Acknowledge,Low
train:723:0,train,"hello--hello, glenn. good mor--afternoon.",👋,Greet,Greet,Low
train:723:1,train,good afternoon to you.,😊,Greet,Greet,Low
train:723:2,train,how far would i have to drive to see a prairie?,🤔,Asking for opinions,Asking for opinions,Low
train:723:3,train,thank you.,💛,Thank,Thank,Low
train:723:5,train,are you okay?,🫒,Care,Care,Low
train:723:6,train,"uh, yeah. i'm okay.",✅,Acknowledge,Acknowledge,Low
train:723:7,train,you want me to touch my nose with my finger?,🤔,Asking for opinions,Asking for opinions,Low
train:723:8,train,okay? you want me to do the alphabet backwards?,❓,Asking for opinions,Asking for opinions,Low
train:725:2,train,"well, i didn't wanna change it up too much.",📖,Explain,Explain,Low
train:725:3,train,"you know, baby steps, right?",👌,Confirm,Confirm,Low
train:725:4,train,"also, i don't really know what i'm doing yet.",📖,Explain,Explain,Low
train:725:5,train,"also, i'm drunk.",💬,Explain,Explain,Low
train:725:6,train,"yeah, no, i-i like it, i like it.",👏,Praise,Praise,Low
train:727:1,train,"tell me, do you think that brett and brittany would be good together?",👌,Confirm,Confirm,Low
train:727:4,train,"'cause i hired miles and lisa, and now they're in love.",💡,Explain,Explain,Low
train:727:7,train,"no, i just don't think people come here to find love.",🙅,Oppose,Oppose,High
train:727:8,train,"this is a workplace, not match.com.",❗,Emphasize,Emphasize,Low
train:727:9,train,"it's like christian mingle, but for everyone.",📖,Explain,Explain,Low
train:727:10,train,oh! that is such a good idea.,🌟,Praise,Praise,Low
train:729:0,train,"you guys, look what jeff just sent me.",💎,Flaunt,Flaunt,Medium
train:729:4,train,"i guess he really loves me, huh?",👌,Confirm,Confirm,Low
train:729:5,train,look what jeff just sent me.,💎,Flaunt,Flaunt,Medium
train:729:6,train,"oh, we need more tissue paper.",👋,Leave,Leave,Low
train:729:7,train,what's wrong with him?,🛡️,Care,Care,Low
train:729:10,train,and sandra is just making it up to get attention.,💬,Explain,Explain,Low
train:729:11,train,"so sandra has a fake boyfriend, she sent herself flowers, and mateo is dating jeff?",👌,Confirm,Confirm,Low
train:730:0,train,hello.,👋,Greet,Greet,Low
train:730:1,train,welcome to cloud 9.,👋,Greet,Greet,Low
train:730:2,train,and you must be the little princess we've been expecting.,👏,Praise,Praise,Low
train:730:5,train,"oh, that's so sweet.",🌟,Praise,Praise,Low
train:731:0,train,you're doing great.,🌟,Praise,Praise,Low
train:731:1,train,"good, good, good.",👏,Praise,Praise,Low
train:731:3,train,"hey, jonah.",😊,Greet,Greet,Low
train:731:4,train,"do you think elias and pauline would be good together, or am i just projecting laurel and hardy?",❓,Asking for opinions,Asking for opinions,Low
train:731:6,train,"oh, wow. i'm--i'm so sorry.",😔,Apologise,Apologise,Low
train:731:8,train,i'm so sorry.,🥺,Apologise,Apologise,Low
train:732:1,train,what about you? any hot valentine's day plans?,🫒,Care,Care,Low
train:732:2,train,"no, probably sit in the park, feed the ducks.",📅,Plan,Plan,Low
train:732:4,train,"you can come if you want, but it's bring your own nitrous.",📩,Invite,Invite,Low
train:732:5,train,"hey, myrtle, do you date anymore?",👌,Confirm,Confirm,Low
train:734:0,train,"hey. oh, what is arthur doing in womenswear?",🛡️,Care,Care,Low
train:734:2,train,"no, glenn, i put him there.",📖,Explain,Explain,Low
train:734:3,train,"you know, just to mix things up, give people an opportunity to work with other people and...",💡,Explain,Explain,Low
train:734:5,train,"glenn, again, an arrow. never mind.",🫐,Comfort,Comfort,Low
train:734:11,train,"yeah. oh, hey, you see that guy?",✅,Confirm,Confirm,Low
train:735:0,train,i'm so sorry.,🥺,Apologise,Apologise,Low
train:735:1,train,are you okay?,🫒,Care,Care,Low
train:735:4,train,are you sure? 'cause i can give you a ride to the hospital.,🛡️,Care,Care,Low
train:735:5,train,"well, i--i mean, i'm better with the--the four wheels.",📖,Explain,Explain,Low
train:735:6,train,"this is why people hate valentine's day, you know, drone strikes.",💬,Explain,Explain,Low
train:738:1,train,wh--what you got there?,🛡️,Care,Care,Low
train:738:6,train,just look around. look-look under that sweater.,⏰,Arrange,Arrange,Low
train:738:8,train,"you don't have to cry, sweetie.",🥹,Comfort,Comfort,Low
train:738:9,train,he won't leave me alone.,😮‍💨,Complain,Complain,High
train:738:10,train,why won't he leave me alone?,🙄,Complain,Complain,High
train:739:0,train,that's crazy.,😤,Complain,Complain,High
train:739:1,train,"um, factually similar.",❗,Emphasize,Emphasize,Low
train:739:3,train,arthur? he's so sweet.,🌟,Praise,Praise,Low
train:739:6,train,we were just watching them for our own pleasure.,💡,Explain,Explain,Low
train:739:7,train,"stop talking, glenn.",⚠️,Prevent,Prevent,Medium
train:740:4,train,"actually, yeah, i'm going to an mma fight with my boyfriend.",📋,Plan,Plan,Low
train:740:5,train,oh.,✅,Acknowledge,Acknowledge,Low
train:740:6,train,"yeah, i'm free.",👍,Agree,Agree,Low
train:741:0,train,she's not the shoplifter.,📢,Inform,Inform,Low
train:741:2,train,"oh, no, no, no. that was just--",👎,Oppose,Oppose,High
train:741:6,train,thank you for your service.,👍,Thank,Thank,Low
train:744:4,train,"ahh, what a small, thoughtful...small gift.",😏,Taunt,Taunt,High
train:744:5,train,i just don't think everybody at work needs to know you're my boyfriend.,💡,Explain,Explain,Low
train:744:6,train,boyfriend?,✅,Confirm,Confirm,Low
train:744:7,train,i'm your boyfriend?,🤝,Confirm,Confirm,Low
train:744:11,train,i'm sorry. i've been dealing with a lot of drama today.,🙏,Apologise,Apologise,Low
train:747:0,train,are you asking 'cause i'm in charge of the warehouse now?,😕,Doubt,Doubt,Medium
train:747:1,train,i did. yeah.,🤝,Agree,Agree,Low
train:747:2,train,a promotion with no raise. well done.,🌟,Praise,Praise,Low
train:747:3,train,okay. so you can clean this up?,🗓️,Arrange,Arrange,Low
train:747:4,train,"i got a lot on my plate right now, uh, but sure, yeah, i'll take care of it.",🤝,Agree,Agree,Low
train:747:5,train,you know what they say: heavy is the head that wears the pants.,🤣,Joke,Joke,Low
train:748:0,train,"ooh, it is pleasant as hell in here.",🌟,Praise,Praise,Low
train:748:1,train,"i'm trying to get them to fix it, but, my god, these people!",😤,Complain,Complain,High
train:748:2,train,i'm doing everything i can.,📝,Inform,Inform,Low
train:748:3,train,are you?,🤨,Doubt,Doubt,Medium
train:748:6,train,"okay, i can work with that. yes, glenn.",🤝,Agree,Agree,Low
train:748:7,train,get out there and fix that heating system or whatever.,🗓️,Arrange,Arrange,Low
train:748:8,train,"yeah, go fix it. and take your time!",📅,Arrange,Arrange,Low
train:749:0,train,you're getting your gross guy heat all over me.,🤨,Criticize,Criticize,High
train:749:1,train,"oh, i'm sorry. is this better? is this helping?",😏,Taunt,Taunt,High
train:750:0,train,i am really sorry.,😔,Apologise,Apologise,Low
train:750:1,train,it's fine. it's not real leather anyway.,🫐,Comfort,Comfort,Low
train:750:3,train,no. just other it guys.,👎,Oppose,Oppose,High
train:750:5,train,here you are.,ℹ️,Inform,Inform,Low
train:750:6,train,i'm in it.,📛,Introduce,Introduce,Low
train:752:0,train,"marcus, a customer just slipped on the spill.",📝,Inform,Inform,Low
train:752:1,train,"yeah, sorry, ames. we'll get to it.",🥺,Apologise,Apologise,Low
train:752:2,train,"yeah, no, i get it. it's hot everywhere.",✅,Agree,Agree,Low
train:752:3,train,okay. relax.,🥹,Comfort,Comfort,Low
train:752:4,train,there's no need to get emotional.,🫐,Comfort,Comfort,Low
train:752:5,train,emotional? am i-am i getting emotional?,😕,Doubt,Doubt,Medium
train:752:6,train,kind of?,😕,Doubt,Doubt,Medium
train:752:7,train,"okay, you know what? it's not a big deal.",🥹,Comfort,Comfort,Low
train:752:9,train,did you just tell me to smile?,😕,Doubt,Doubt,Medium
train:752:10,train,"yeah, you little sourpuss.",😜,Joke,Joke,Low
train:754:0,train,i cannot believe he told me to smile.,😮‍💨,Complain,Complain,High
train:754:1,train,yeah. that's so out of line.,🤔,Criticize,Criticize,High
train:754:2,train,i completely agree.,👍,Agree,Agree,Low
train:754:4,train,do not touch this spill.,🛑,Warn,Warn,Medium
train:754:5,train,"you know what? maybe let's just let this one go, you know?",💡,Advise,Advise,Low
train:754:6,train,because the--the heat.,💡,Explain,Explain,Low
train:754:7,train,so what are you saying?,😕,Doubt,Doubt,Medium
train:754:8,train,we should let marcus off the hook because it's hot?,🤔,Doubt,Doubt,Medium
train:754:9,train,"no. no. no. it's just-remembering that all of us are in the hot store, you know?",👎,Oppose,Oppose,High
train:754:10,train,what is wrong with people today?,🙄,Complain,Complain,High
train:755:3,train,"your job is to hand me the tools as i need them, okay?",📢,Inform,Inform,Low
train:755:4,train,it's  handsy.  plural.,❗,Emphasize,Emphasize,Low
train:755:5,train,"in fact, my ancestors built the ships that brought the very first african-americans to this country.",👋,Introduce,Introduce,Low
train:755:6,train,no!,🙅,Oppose,Oppose,High
train:755:7,train,no.,⛔,Oppose,Oppose,High
train:756:0,train,i've got a really bad itch at the back of my throat.,ℹ️,Inform,Inform,Low
train:756:3,train,"oh, it's not your fault. you're just an annoying person.",😑,Criticize,Criticize,High
train:756:4,train,"look, let's be adults and just not talk.",☝️,Advise,Advise,Low
train:756:7,train,thank you both for agreeing to sit down.,💛,Thank,Thank,Low
train:758:0,train,"okay, so...",📢,Inform,Inform,Low
train:758:1,train,we had to let marcus go.,ℹ️,Inform,Inform,Low
train:758:2,train,are you allowed to fire people?,🤨,Doubt,Doubt,Medium
train:758:5,train,"anyway, the rest of the warehouse walked out in solidarity with him.",📢,Inform,Inform,Low
train:758:9,train,"guys, it's fine, okay?",🫐,Comfort,Comfort,Low
train:758:10,train,"i've got the manual, so, you know, all we need, really, are two people throwing the truck, one pushing the line, one on bulk transition, two pulling pallets, three pre-pushing hba, and one person bowling c and d.",📅,Arrange,Arrange,Low
train:758:11,train,let's do that.,🗓️,Arrange,Arrange,Low
train:759:0,train,"okay, guys. good work.",👏,Praise,Praise,Low
train:759:3,train,"don't worry, sandra. everything's gonna be okay.",💛,Comfort,Comfort,Low
train:759:4,train,just toss the scanner over to us.,📅,Arrange,Arrange,Low
train:760:1,train,"oh, you want examples?",👌,Confirm,Confirm,Low
train:760:4,train,really? that's awesome.,🏆,Praise,Praise,Low
train:760:6,train,"i'm just a pathetic, useless old man, apparently descended from slave traders.",😮‍💨,Complain,Complain,High
train:760:7,train,"you're not that old. what are you, like, 40?",👌,Confirm,Confirm,Low
train:760:8,train,should you be up this high?,😕,Doubt,Doubt,Medium
train:761:1,train,you ever considered a career as a pro wrestler?,🤣,Joke,Joke,Low
train:761:2,train,"actually, yes.",🤝,Agree,Agree,Low
train:761:5,train,"did you have the big, poufy hair?",👌,Confirm,Confirm,Low
train:761:8,train,that heat was making me insane.,🙄,Complain,Complain,High
train:762:0,train,"like, if you could do anything, what would you do?",🤔,Asking for opinions,Asking for opinions,Low
train:762:4,train,we should just go!,☝️,Advise,Advise,Low
train:762:5,train,"we should just travel the world together, you and me.",☝️,Advise,Advise,Low
train:762:10,train,yeah?,✅,Confirm,Confirm,Low
train:762:11,train,sure.,🤝,Agree,Agree,Low
train:763:1,train,"hey, marcus, um, we need to talk.",🍽️,Invite,Invite,Low
train:763:2,train,totally. i am so sorry.,🥺,Apologise,Apologise,Low
train:763:5,train,i'm really sorry.,😔,Apologise,Apologise,Low
train:763:7,train,so i'm gonna let you off with a warning this time.,📢,Inform,Inform,Low
train:763:8,train,so we can just all come back to work.,🤝,Confirm,Confirm,Low
train:765:0,train,really? i've never heard that.,🤨,Doubt,Doubt,Medium
train:765:1,train,"oh, it's true.",📢,Inform,Inform,Low
train:765:3,train,"yeah, all of it.",👍,Agree,Agree,Low
train:765:4,train,"hey, sandra. how's it going?",✨,Greet,Greet,Low
train:765:5,train,"how are things, sandra.",👋,Greet,Greet,Low
train:765:6,train,how's jeff?,🧡,Care,Care,Low
train:765:8,train,i hate paris.,📝,Inform,Inform,Low
train:765:9,train,that place is just one giant gay ashtray.,😤,Complain,Complain,High
train:766:0,train,we're gonna save a lot of lives today.,🗺️,Plan,Plan,Low
train:766:1,train,"it's mostly handing out informational pamphlets, right?",🤝,Confirm,Confirm,Low
train:766:2,train,and buttons.,ℹ️,Inform,Inform,Low
train:766:3,train,"yes, really.",✅,Acknowledge,Acknowledge,Low
train:766:4,train,why is that a surprise?,😕,Doubt,Doubt,Medium
train:766:5,train,it's not.,👎,Oppose,Oppose,High
train:766:6,train,you don't think i could be a doctor?,🤨,Doubt,Doubt,Medium
train:766:7,train,"no, no-no-no. glenn, come on, no.",👎,Oppose,Oppose,High
train:766:8,train,i just--i'm--i don't even think i could be a doctor.,💬,Explain,Explain,Low
train:766:9,train,oh... not even you.,😏,Taunt,Taunt,High
train:766:10,train,"no, that's--i-that's out of context.",👎,Oppose,Oppose,High
train:766:11,train,i have to take these buttons over there.,🏃,Leave,Leave,Low
train:767:0,train,"yeah, that all sounds pretty medically accurate.",✅,Agree,Agree,Low
train:767:1,train,"hey, guys, if you knew that a friend's boyfriend was cheating on her with another one of your friends, would you say something?",❓,Asking for opinions,Asking for opinions,Low
train:767:4,train,"okay, look, i wasn't actually home sick yesterday.",ℹ️,Inform,Inform,Low
train:767:5,train,this is your reaction?,😕,Doubt,Doubt,Medium
train:767:6,train,what do i do? do i--do i-do i talk to her?,🤔,Asking for opinions,Asking for opinions,Low
train:767:7,train,do i confront him?,🤔,Asking for opinions,Asking for opinions,Low
train:767:8,train,"okay, here's what you do.",☝️,Advise,Advise,Low
train:767:9,train,"this is like  jurassic park.  you start messing around with something you don't know anything about, and before you know it, you're getting bit in half while you're sitting on the toilet.",💬,Explain,Explain,Low
train:767:10,train,"it's true, amy. that's what happens.",✅,Agree,Agree,Low
train:767:11,train,"okay, thanks, guys.",💛,Thank,Thank,Low
train:767:12,train,this was great. mm-hmm.,👏,Praise,Praise,Low
train:767:13,train,helpful. thanks.,👍,Thank,Thank,Low
train:767:14,train,should we just tell her that mateo's the one who's been dating jeff all along?,💭,Asking for opinions,Asking for opinions,Low
train:767:15,train,"nah, it's better just to stay out of it.",🙅,Oppose,Oppose,High
train:769:0,train,i picked you up some samples.,📝,Inform,Inform,Low
train:769:3,train,"well played. now i call first dibs, but you can use those with whoever you want-i mean, me, someone else, solo work.",📢,Inform,Inform,Low
train:769:4,train,solo work?,😕,Doubt,Doubt,Medium
train:771:0,train,so neither one of you thought it was worth mentioning that sandra's been making it up the whole time?,🤔,Doubt,Doubt,Medium
train:771:1,train,"yeah, 'cause that's usually why people with low self-esteem commit to elaborate lies for weeks-'cause they just want the truth to come out.",💬,Explain,Explain,Low
train:771:2,train,"okay, i can fix this. i just need to gather everybody who knows, and then tell them.",📋,Plan,Plan,Low
train:771:3,train,just do nothing.,🧠,Advise,Advise,Low
train:771:4,train,"man, that is true. he's killing it.",👍,Agree,Agree,Low
train:772:0,train,"oh, all right.",👍,Agree,Agree,Low
train:772:1,train,"i mean, what are you? the president of bikes?",🙄,Taunt,Taunt,High
train:772:2,train,you--are you okay? glenn?,🛡️,Care,Care,Low
train:772:3,train,are you okay?,🧡,Care,Care,Low
train:773:1,train,"uh, what? uh, no, why?   um...i don't know, you know.",⛔,Oppose,Oppose,High
train:773:2,train,she's always yap-yapping about something.,🙄,Complain,Complain,High
train:773:3,train,"you know, something suspicious is going on.",ℹ️,Inform,Inform,Low
train:773:4,train,what she described to me yesterday...,📢,Inform,Inform,Low
train:775:0,train,"hey, guys, did you hear?",👋,Greet,Greet,Low
train:775:1,train,sandra's pregnant with my boyfriend's baby.,📢,Inform,Inform,Low
train:775:2,train,"oh, yeah, there's a card going around.",🤝,Agree,Agree,Low
train:775:3,train,i'm gonna fix it.,📋,Plan,Plan,Low
train:775:4,train,"okay, what if we say that jeff has a twin brother, and sandra has been dating him?",🧠,Advise,Advise,Low
train:775:5,train,"so the jeff that sandra's been talking about is jeff's twin brother, jeff?",🤨,Doubt,Doubt,Medium
train:776:0,train,"hey, you wanna donate to a good cause?",🎉,Invite,Invite,Low
train:776:1,train,"wait, sandra's pregnant?",😕,Doubt,Doubt,Medium
train:776:2,train,"yeah, jeff knocked her up, then dumped her for mateo.",📝,Inform,Inform,Low
train:776:5,train,"yeah, totally.",👍,Agree,Agree,Low
train:776:6,train,"jonah, you might be book smart and bike smart, but you don't get to be right about everything.",🙅,Oppose,Oppose,High
train:776:7,train,"oh, really? that--there's a refreshing change of pace.",🤡,Taunt,Taunt,High
train:778:0,train,"okay, glenn. glenn?",💛,Comfort,Comfort,Low
train:778:1,train,"i need you to hold your hand like this, and breathe through alternating nostrils, okay?",📅,Arrange,Arrange,Low
train:778:3,train,"no, it was after the-for the next one.",👎,Oppose,Oppose,High
train:778:4,train,"you'll see. i mean, i hope you don't see.",💡,Explain,Explain,Low
train:778:5,train,"no, stop telling me what to do!",🙅,Refuse,Refuse,Low
train:778:6,train,"no, i don't. he's stupid!",🙅,Refuse,Refuse,Low
train:778:7,train,okay. how's that working out for ya?,🛡️,Care,Care,Low
train:780:0,train,"no, it's okay.",🫐,Comfort,Comfort,Low
train:780:1,train,okay.,✅,Acknowledge,Acknowledge,Low
train:781:0,train,okay.,🤝,Acknowledge,Acknowledge,Low
train:781:1,train,are we gonna get a destination wedding?,💭,Asking for opinions,Asking for opinions,Low
train:781:2,train,"like, how many cute little garrett-dina babies are you gonna have?",🤔,Asking for opinions,Asking for opinions,Low
train:781:3,train,"hey, dina, amy went to go see  lego batman  yesterday.",ℹ️,Inform,Inform,Low
train:781:4,train,i'm gonna have to call you back.,👋,Leave,Leave,Low
train:784:3,train,you want me to talk to jeff?,👌,Confirm,Confirm,Low
train:784:4,train,"oh, sorry.",🥺,Apologise,Apologise,Low
train:784:5,train,i just thought he was really into you.,😏,Taunt,Taunt,High
train:784:6,train,he is.   he's obsessed with me.,💎,Flaunt,Flaunt,Medium
train:786:0,train,was that jeff?,👌,Confirm,Confirm,Low
train:786:3,train,"no, no, he, um-  is sending somebody right away.",📖,Explain,Explain,Low
train:786:4,train,"i told you, he's obsessed with me.",😎,Flaunt,Flaunt,Medium
train:786:5,train,"oh, you really need to work on your good news voice.",😏,Taunt,Taunt,High
train:786:7,train,they're very helpful.,👏,Praise,Praise,Low
train:787:0,train,"hey, sandra.",👋,Greet,Greet,Low
train:787:1,train,"hey, how was your vacation?",🫒,Care,Care,Low
train:787:2,train,so who you nominating?,🛡️,Care,Care,Low
train:787:5,train,i just need to warm him up quick.,📋,Plan,Plan,Low
